{
  "operations": {
    "status": [
      {
        "positional": [],
        "options": {},
        "prefix": []
      }
    ],
    "inventory": [
      {
        "positional": [],
        "options": {},
        "prefix": []
      }
    ],
    "entities": [
      {
        "positional": [],
        "options": {},
        "prefix": []
      }
    ],
    "entity": [
      {
        "positional": [],
        "options": {},
        "prefix": []
      },
      {
        "positional": [
          [
            "target",
            {
              "type": "string"
            }
          ]
        ],
        "options": {},
        "prefix": []
      }
    ],
    "target": [
      {
        "positional": [],
        "options": {},
        "prefix": []
      }
    ],
    "block": [
      {
        "positional": [
          [
            "x",
            {
              "type": "coordinate"
            }
          ],
          [
            "y",
            {
              "type": "coordinate"
            }
          ],
          [
            "z",
            {
              "type": "coordinate"
            }
          ]
        ],
        "options": {},
        "prefix": []
      }
    ],
    "blocks": [
      {
        "positional": [
          [
            "type",
            {
              "type": "string"
            }
          ]
        ],
        "options": {
          "radius": {
            "type": "integer",
            "clause": "radius"
          },
          "limit": {
            "type": "integer",
            "clause": "limit"
          }
        },
        "prefix": []
      },
      {
        "positional": [
          [
            "type",
            {
              "type": "string"
            }
          ],
          [
            "x",
            {
              "type": "coordinate",
              "clause": "at"
            }
          ],
          [
            "y",
            {
              "type": "coordinate"
            }
          ],
          [
            "z",
            {
              "type": "coordinate"
            }
          ]
        ],
        "options": {
          "radius": {
            "type": "integer",
            "clause": "radius"
          },
          "limit": {
            "type": "integer",
            "clause": "limit"
          }
        },
        "prefix": []
      }
    ],
    "resume": [
      {
        "positional": [],
        "options": {},
        "prefix": []
      }
    ],
    "reconnect": [
      {
        "positional": [],
        "options": {},
        "prefix": []
      }
    ],
    "despawn": [
      {
        "positional": [],
        "options": {},
        "prefix": []
      }
    ],
    "forget": [
      {
        "positional": [],
        "options": {},
        "prefix": []
      }
    ],
    "visibility": [
      {
        "positional": [
          [
            "visibility",
            {
              "type": "string",
              "choices": [
                "shared",
                "private"
              ]
            }
          ]
        ],
        "options": {},
        "prefix": []
      }
    ],
    "stop": [
      {
        "positional": [],
        "options": {},
        "prefix": []
      }
    ],
    "dismount": [
      {
        "positional": [],
        "options": {},
        "prefix": []
      }
    ],
    "menu": [
      {
        "positional": [],
        "options": {},
        "prefix": []
      }
    ],
    "spawn": [
      {
        "positional": [],
        "options": {},
        "prefix": []
      },
      {
        "positional": [
          [
            "x",
            {
              "type": "coordinate"
            }
          ],
          [
            "y",
            {
              "type": "coordinate"
            }
          ],
          [
            "z",
            {
              "type": "coordinate"
            }
          ]
        ],
        "options": {
          "yaw": {
            "type": "number",
            "clause": "facing"
          },
          "pitch": {
            "type": "number"
          },
          "dimension": {
            "type": "string",
            "clause": "in"
          }
        },
        "prefix": [
          "at"
        ]
      }
    ],
    "rename": [
      {
        "positional": [
          [
            "name",
            {
              "type": "string"
            }
          ]
        ],
        "options": {},
        "prefix": []
      }
    ],
    "owner": [
      {
        "positional": [
          [
            "gamertag",
            {
              "type": "string"
            }
          ]
        ],
        "options": {},
        "prefix": []
      }
    ],
    "tp": [
      {
        "positional": [
          [
            "target",
            {
              "type": "string"
            }
          ]
        ],
        "options": {},
        "prefix": []
      },
      {
        "positional": [
          [
            "x",
            {
              "type": "coordinate"
            }
          ],
          [
            "y",
            {
              "type": "coordinate"
            }
          ],
          [
            "z",
            {
              "type": "coordinate"
            }
          ]
        ],
        "options": {
          "yaw": {
            "type": "number"
          },
          "pitch": {
            "type": "number"
          },
          "dimension": {
            "type": "string",
            "clause": "in"
          },
          "facing": {
            "type": "string",
            "clause": "facing"
          },
          "facingX": {
            "type": "coordinate",
            "clause": "facing"
          },
          "facingY": {
            "type": "coordinate"
          },
          "facingZ": {
            "type": "coordinate"
          }
        },
        "prefix": []
      }
    ],
    "move": [
      {
        "positional": [
          [
            "direction",
            {
              "type": "string",
              "choices": [
                "forward",
                "backward",
                "left",
                "right",
                "stop"
              ]
            }
          ]
        ],
        "options": {
          "ticks": {
            "type": "integer",
            "clause": "for"
          }
        },
        "prefix": []
      }
    ],
    "look": [
      {
        "positional": [
          [
            "yaw",
            {
              "type": "number"
            }
          ],
          [
            "pitch",
            {
              "type": "number"
            }
          ]
        ],
        "options": {},
        "prefix": []
      },
      {
        "positional": [
          [
            "x",
            {
              "type": "coordinate"
            }
          ],
          [
            "y",
            {
              "type": "coordinate"
            }
          ],
          [
            "z",
            {
              "type": "coordinate"
            }
          ]
        ],
        "options": {},
        "prefix": [
          "at"
        ]
      }
    ],
    "swap": [
      {
        "positional": [
          [
            "a",
            {
              "type": "integer"
            }
          ],
          [
            "b",
            {
              "type": "integer"
            }
          ]
        ],
        "options": {},
        "prefix": []
      }
    ],
    "hold": [
      {
        "positional": [
          [
            "item",
            {
              "type": "string"
            }
          ]
        ],
        "options": {},
        "prefix": []
      }
    ],
    "hotbar": [
      {
        "positional": [],
        "options": {},
        "prefix": []
      },
      {
        "positional": [
          [
            "slot",
            {
              "type": "integer"
            }
          ]
        ],
        "options": {},
        "prefix": []
      }
    ],
    "radius": [
      {
        "positional": [],
        "options": {},
        "prefix": []
      },
      {
        "positional": [
          [
            "value",
            {
              "type": "integerOrDefault"
            }
          ]
        ],
        "options": {},
        "prefix": []
      }
    ],
    "interact": [
      {
        "positional": [],
        "options": {},
        "prefix": []
      },
      {
        "positional": [
          [
            "x",
            {
              "type": "coordinate"
            }
          ],
          [
            "y",
            {
              "type": "coordinate"
            }
          ],
          [
            "z",
            {
              "type": "coordinate"
            }
          ]
        ],
        "options": {},
        "prefix": []
      },
      {
        "positional": [
          [
            "x",
            {
              "type": "coordinate"
            }
          ],
          [
            "y",
            {
              "type": "coordinate"
            }
          ],
          [
            "z",
            {
              "type": "coordinate"
            }
          ],
          [
            "face",
            {
              "type": "string",
              "choices": [
                "down",
                "up",
                "north",
                "south",
                "west",
                "east"
              ]
            }
          ]
        ],
        "options": {},
        "prefix": []
      },
      {
        "positional": [
          [
            "target",
            {
              "type": "string"
            }
          ]
        ],
        "options": {
          "mode": {
            "type": "string",
            "choices": [
              "once",
              "continuous",
              "stop"
            ]
          },
          "interval": {
            "type": "integer",
            "clause": "interval"
          },
          "ticks": {